{
  "version": 1,
  "name": "box_hole",
  "output_dir": "outputs",
  "length_unit": "mm",
  "output_unit": "mm",
  "geometry": {
    "kind": "cut",
    "objects": [
      {"kind": "box", "parameters": {"length": 80.0, "width": 60.0, "height": 20.0}},
      {"kind": "cylinder", "parameters": {"radius": 12.0, "height": 20.0, "origin": [40.0, 30.0, 0.0]}}
    ]
  },
  "mesh": {"mode": "auto", "scale_fraction": 0.07, "element_budget": 10000}
}

